{
  "version": 1,
  "workspace": "synthetic-aggregate",
  "workflow": "aggregate",
  "comparison": {
    "class": "equivalent_under_conditions",
    "rationale": "Synthetic exports with explicitly declared definitions and scope."
  },
  "tolerance": {
    "absolute": "1",
    "relative": "0.01"
  },
  "reference": {
    "contract": "reference.contract.json",
    "csv": "reference.csv"
  },
  "observed": {
    "contract": "observed.contract.json",
    "csv": "observed.csv"
  }
}
